{"type":"group","name":"waitfortestpackage","enabled":true,"items":[{"type":"alias","name":"","enabled":true,"actions":[{"action":"notify","enabled":true,"notice":"Before WaitFor","notice_fg":"#ff0000","notice_bg":"#000000"},{"action":"waitfor","enabled":true,"text":"hi","matching":"substring","whole_words":false,"case_sensitive":false,"expire":5},{"action":"notify","enabled":true,"notice":"After WaitFor","notice_fg":"#ff0000","notice_bg":"#000000"},{"action":"waitfor","enabled":true,"text":"foo","matching":"substring","whole_words":false,"case_sensitive":true,"expire":0},{"action":"notify","enabled":true,"notice":"after second WaitFor","notice_fg":"#ff0000","notice_bg":"#000000"}],"text":"test waitfor","matching":"exact","whole_words":true,"case_sensitive":true,"prefix_suffix":true}],"description":""}