{"type":"group","name":"timeouttestpackage","enabled":true,"items":[{"type":"function","name":"onInstall","enabled":true,"code":"// Place any code here you'd like to autorun when the package is installed"},{"type":"function","name":"onUninstall","enabled":true,"code":"// Place any code here you'd like to autorun when the package is uninstalled"},{"type":"alias","name":"","enabled":true,"actions":[{"action":"wait","enabled":true,"seconds":2,"milliseconds":36},{"action":"notify","enabled":true,"notice":"Timeout Triggered","notice_fg":"#ff0000","notice_bg":"#000000"}],"text":"test timeout","matching":"exact","whole_words":true,"case_sensitive":true,"prefix_suffix":true}],"description":""}